{
  "schema_version": "0.3.0",
  "project_id": "NINEL",
  "candidate_models": [
    {
      "name": "Three Act",
      "fit": "Causal turns.",
      "benefits": [
        "Clear escalation."
      ],
      "risks": [
        "Can feel rigid."
      ]
    },
    {
      "name": "Serial mystery",
      "fit": "Two linked reveals.",
      "benefits": [
        "Renewable questions."
      ],
      "risks": [
        "Can defer answers."
      ]
    }
  ],
  "selection_criteria": [
    {
      "criterion": "causality",
      "brief_evidence": "The diagnostic response changes Ninel's goal.",
      "priority": "high"
    }
  ],
  "selected_model": "Serial mystery",
  "hybrid_components": [],
  "selection_rationale": "The episodes resolve one question and open another.",
  "intentional_deviations": [
    "The first episode ends on a changed goal."
  ],
  "plotlines": [
    {
      "plotline_id": "NINEL-PL01",
      "title": "Awakening",
      "function": "Explore Ninel\u2019s uncertain return.",
      "progression": "Voluntary breath leads to a question about the past."
    }
  ],
  "sequences": [
    {
      "sequence_id": "NINEL-SQ01",
      "title": "Detection",
      "purpose": "Plant the diagnostic response.",
      "plotline_ids": [
        "NINEL-PL01"
      ],
      "event_ids": [
        "NINEL-EV001"
      ]
    },
    {
      "sequence_id": "NINEL-SQ02",
      "title": "Response",
      "purpose": "Pay off the diagnostic response.",
      "plotline_ids": [
        "NINEL-PL01"
      ],
      "event_ids": [
        "NINEL-EV002"
      ]
    }
  ],
  "events": [
    {
      "event_id": "NINEL-EV001",
      "order": 1,
      "sequence_id": "NINEL-SQ01",
      "plotline_ids": [
        "NINEL-PL01"
      ],
      "description": "Ninel chooses to breathe.",
      "story_function": "setup",
      "causal_change": "Ninel can address the room.",
      "retention_effect": "Opens a concrete question."
    },
    {
      "event_id": "NINEL-EV002",
      "order": 2,
      "sequence_id": "NINEL-SQ02",
      "plotline_ids": [
        "NINEL-PL01"
      ],
      "description": "Argo says she returned from a failure.",
      "story_function": "payoff",
      "causal_change": "Ninel learns Argo knows something about her past.",
      "retention_effect": "Answers and enlarges the question."
    }
  ],
  "setup_payoffs": [
    {
      "setup_event_id": "NINEL-EV001",
      "payoff_event_id": "NINEL-EV002",
      "relationship": "The welcome back prompts a question about the return."
    }
  ],
  "assumptions": [
    "The two-event allocation is a demonstration proposal based on the legacy scene brief."
  ],
  "uncertainties": []
}
